{"artifacts":[{"base64":"","bytes":0,"format":"ubsan-text","id":"probe-runtime-stderr","retained_sha256":"e3b0c44298fc1c149afbf4c8996fb92427ae41e4649b934ca495991b7852b855","sha256":"e3b0c44298fc1c149afbf4c8996fb92427ae41e4649b934ca495991b7852b855","translation_unit":null,"truncated":false},{"base64":"","bytes":0,"format":"ubsan-text","id":"runtime-stderr","retained_sha256":"e3b0c44298fc1c149afbf4c8996fb92427ae41e4649b934ca495991b7852b855","sha256":"e3b0c44298fc1c149afbf4c8996fb92427ae41e4649b934ca495991b7852b855","translation_unit":null,"truncated":false}],"assurance_eligibility":"not_eligible","baseline":{"component":"ubsan_quality_probe","configuration":{"path":"/home/jefferson/s-core_sw_fabric/profiles/ubsan-gcc11-local-v1.yaml","sha256":"4ce48c83af29d15f40a7b024914ea6da2abd2b3aa49ff865d40489f15d99d086"},"defines":[],"expected_units":["check.cpp"],"files":[{"path":"check.cpp","sha256":"3cab60888d9749b778d38a0e7868b158ed60476cffe7db79d3b5b3d3be3aa712"}],"full_digest":"1cf00311834808cfe3625919e1c95ad1f484692aefc6da062ba17b19d647ea1e","include_dirs":[],"language":"c++17","profile":{"path":"/home/jefferson/s-core_sw_fabric/profiles/s-core-quality-v1.yaml","sha256":"720a64d14ecc193e034a45e3c68dffed27df1d23837b886268af55acd1413ec9"},"source_digest":"ca4d1efe4fd798ae78e180d6a0ed6f22f60e4b50751fb7b1701f44cafdc282c6","toolchain":{"path":"/home/jefferson/s-core_sw_fabric/profiles/gcc11-sanitizers-local-v1.yaml","sha256":"c19f6e1886a08b1f74a66ed4ca0c673acfdd4134af827bd1649e81a162299033"},"translation_units":["check.cpp"]},"capability":{"checks":["ubsan_gcc"],"effective_config":{"compile_flags":["-g1","-fsanitize=undefined"],"feature":"ubsan_gcc","generated_binary":{"bytes":16808,"sha256":"379f33c0a1d358cc68e43a758668e2df0c71318cef04a91866e361cad07fb5fb"},"id":"ubsan-gcc11-local-v1","kind":"quality_sanitizer_configuration","link_flags":["-fsanitize=undefined"],"mode":"ubsan","native_features":{"path":"/home/jefferson/s-core_sw_fabric/profiles/native-quality/sanitizer-features.bazel","sha256":"3b3ec4f0ef6ac8c421e1961e60a9d19e60827b3c061361c04e1e6d45b9c4f10c"},"native_runtime":{"path":"/home/jefferson/s-core_sw_fabric/profiles/native-quality/ubsan.env.template","sha256":"2f7f6ed76d89be308e0f9f9c3ecc3ea1e0eee8b003cc2fa2f5d7ae47c0a5c170"},"native_suppressions":{"path":"/home/jefferson/s-core_sw_fabric/profiles/native-quality/ubsan.supp","sha256":"771127140a9a674ae93d0f04d06f744841c249597c0e4d976d41bd53459fa694"},"rendered_runtime":{"UBSAN_OPTIONS":"allow_addr2line=1 exitcode=55 halt_on_error=1 print_stacktrace=1 verbosity=1 suppressions=/tmp/score-quality-3gq_du8k/probe/sanitizers/suppressions/ubsan.supp"},"runtime_name":"UBSAN_OPTIONS","runtime_template":"allow_addr2line=1 exitcode=55 halt_on_error=1 print_stacktrace=1 verbosity=1 suppressions=%ROOT%sanitizers/suppressions/ubsan.supp","schema_version":1,"status":"proposed_local_candidate","suppression_rules":[]},"state":"available"},"configuration":{"adapter":"ubsan","effective":{"compile_flags":["-g1","-fsanitize=undefined"],"feature":"ubsan_gcc","generated_binary":{"bytes":16776,"sha256":"709193dfe3a75167c663d6594c2c56bbf1584e9ccc907ee96e4bc24c552a6003"},"id":"ubsan-gcc11-local-v1","kind":"quality_sanitizer_configuration","link_flags":["-fsanitize=undefined"],"mode":"ubsan","native_features":{"path":"/home/jefferson/s-core_sw_fabric/profiles/native-quality/sanitizer-features.bazel","sha256":"3b3ec4f0ef6ac8c421e1961e60a9d19e60827b3c061361c04e1e6d45b9c4f10c"},"native_runtime":{"path":"/home/jefferson/s-core_sw_fabric/profiles/native-quality/ubsan.env.template","sha256":"2f7f6ed76d89be308e0f9f9c3ecc3ea1e0eee8b003cc2fa2f5d7ae47c0a5c170"},"native_suppressions":{"path":"/home/jefferson/s-core_sw_fabric/profiles/native-quality/ubsan.supp","sha256":"771127140a9a674ae93d0f04d06f744841c249597c0e4d976d41bd53459fa694"},"rendered_runtime":{"UBSAN_OPTIONS":"allow_addr2line=1 exitcode=55 halt_on_error=1 print_stacktrace=1 verbosity=1 suppressions=/tmp/score-quality-3gq_du8k/sanitizers/suppressions/ubsan.supp"},"runtime_name":"UBSAN_OPTIONS","runtime_template":"allow_addr2line=1 exitcode=55 halt_on_error=1 print_stacktrace=1 verbosity=1 suppressions=%ROOT%sanitizers/suppressions/ubsan.supp","schema_version":1,"status":"proposed_local_candidate","suppression_rules":[]},"path":"/home/jefferson/s-core_sw_fabric/profiles/ubsan-gcc11-local-v1.yaml","sha256":"4ce48c83af29d15f40a7b024914ea6da2abd2b3aa49ff865d40489f15d99d086"},"diagnostics":[],"digest":"91cb3da691f1847d33cc4488389cb0629a4b00063d6211cc8d4f92c0e04f3033","engineering_readiness":"not_evaluated","extraction":{"adequacy":"adequate","expected_state":"declared","expected_units":["check.cpp"],"limitations":["Local selected-unit execution; no MISRA/CodeQL/qualified system-header closure"],"missing_units":[],"processed_units":["check.cpp"],"unexpected_units":[]},"gaps":["ADAPTER_UNIMPLEMENTED:codeql-misra","CAPABILITY_NOT_SELECTED:asan","CAPABILITY_NOT_SELECTED:clang-tidy","CAPABILITY_NOT_SELECTED:cppcheck","CODEQL_ELIGIBILITY_UNKNOWN","MANUAL_REVIEW_PENDING","PRODUCTION_AUTHORITY_UNAVAILABLE","RULE_MAPPING_UNKNOWN","TOOL_CONFIDENCE_UNKNOWN"],"kind":"quality_ubsan_analysis_run","origin":"local_unprotected_execution","outcome":"completed","phases":[{"argv":["/usr/bin/x86_64-linux-gnu-g++-11","--version"],"elapsed_seconds":0.00103,"error":null,"exit_code":0,"name":"probe:version","stderr":{"base64":"","bytes":0,"format":"text","retained_sha256":"e3b0c44298fc1c149afbf4c8996fb92427ae41e4649b934ca495991b7852b855","sha256":"e3b0c44298fc1c149afbf4c8996fb92427ae41e4649b934ca495991b7852b855","truncated":false},"stdout":{"base64":"eDg2XzY0LWxpbnV4LWdudS1nKystMTEgKFVidW50dSAxMS40LjAtMXVidW50dTF+MjIuMDQuMykgMTEuNC4wCkNvcHlyaWdodCAoQykgMjAyMSBGcmVlIFNvZnR3YXJlIEZvdW5kYXRpb24sIEluYy4KVGhpcyBpcyBmcmVlIHNvZnR3YXJlOyBzZWUgdGhlIHNvdXJjZSBmb3IgY29weWluZyBjb25kaXRpb25zLiAgVGhlcmUgaXMgTk8Kd2FycmFudHk7IG5vdCBldmVuIGZvciBNRVJDSEFOVEFCSUxJVFkgb3IgRklUTkVTUyBGT1IgQSBQQVJUSUNVTEFSIFBVUlBPU0UuCgo=","bytes":266,"format":"text","retained_sha256":"b2673d1dc6f7deed98e0160d91438be4fd16932a4e13799fbda76847c9a5cf60","sha256":"b2673d1dc6f7deed98e0160d91438be4fd16932a4e13799fbda76847c9a5cf60","truncated":false},"timed_out":false},{"argv":["/usr/bin/x86_64-linux-gnu-g++-11","-std=c++17","-g1","-fsanitize=undefined","-c","/tmp/score-quality-3gq_du8k/probe/source/capability.cpp","-o","/tmp/score-quality-3gq_du8k/probe/object-0.o"],"elapsed_seconds":0.011365,"error":null,"exit_code":0,"name":"probe:compile:capability.cpp","stderr":{"base64":"","bytes":0,"format":"text","retained_sha256":"e3b0c44298fc1c149afbf4c8996fb92427ae41e4649b934ca495991b7852b855","sha256":"e3b0c44298fc1c149afbf4c8996fb92427ae41e4649b934ca495991b7852b855","truncated":false},"stdout":{"base64":"","bytes":0,"format":"text","retained_sha256":"e3b0c44298fc1c149afbf4c8996fb92427ae41e4649b934ca495991b7852b855","sha256":"e3b0c44298fc1c149afbf4c8996fb92427ae41e4649b934ca495991b7852b855","truncated":false},"timed_out":false},{"argv":["/usr/bin/x86_64-linux-gnu-g++-11","/tmp/score-quality-3gq_du8k/probe/object-0.o","-fsanitize=undefined","-o","/tmp/score-quality-3gq_du8k/probe/instrumented-program"],"elapsed_seconds":0.039085,"error":null,"exit_code":0,"name":"probe:link","stderr":{"base64":"","bytes":0,"format":"text","retained_sha256":"e3b0c44298fc1c149afbf4c8996fb92427ae41e4649b934ca495991b7852b855","sha256":"e3b0c44298fc1c149afbf4c8996fb92427ae41e4649b934ca495991b7852b855","truncated":false},"stdout":{"base64":"","bytes":0,"format":"text","retained_sha256":"e3b0c44298fc1c149afbf4c8996fb92427ae41e4649b934ca495991b7852b855","sha256":"e3b0c44298fc1c149afbf4c8996fb92427ae41e4649b934ca495991b7852b855","truncated":false},"timed_out":false},{"argv":["/tmp/score-quality-3gq_du8k/probe/instrumented-program"],"elapsed_seconds":0.001357,"error":null,"exit_code":0,"name":"probe:runtime","stderr":{"base64":"","bytes":0,"format":"text","retained_sha256":"e3b0c44298fc1c149afbf4c8996fb92427ae41e4649b934ca495991b7852b855","sha256":"e3b0c44298fc1c149afbf4c8996fb92427ae41e4649b934ca495991b7852b855","truncated":false},"stdout":{"base64":"","bytes":0,"format":"text","retained_sha256":"e3b0c44298fc1c149afbf4c8996fb92427ae41e4649b934ca495991b7852b855","sha256":"e3b0c44298fc1c149afbf4c8996fb92427ae41e4649b934ca495991b7852b855","truncated":false},"timed_out":false},{"argv":["/usr/bin/x86_64-linux-gnu-g++-11","-std=c++17","-g1","-fsanitize=undefined","-c","/tmp/score-quality-3gq_du8k/source/check.cpp","-o","/tmp/score-quality-3gq_du8k/object-0.o"],"elapsed_seconds":0.014148,"error":null,"exit_code":0,"name":"compile:check.cpp","stderr":{"base64":"","bytes":0,"format":"text","retained_sha256":"e3b0c44298fc1c149afbf4c8996fb92427ae41e4649b934ca495991b7852b855","sha256":"e3b0c44298fc1c149afbf4c8996fb92427ae41e4649b934ca495991b7852b855","truncated":false},"stdout":{"base64":"","bytes":0,"format":"text","retained_sha256":"e3b0c44298fc1c149afbf4c8996fb92427ae41e4649b934ca495991b7852b855","sha256":"e3b0c44298fc1c149afbf4c8996fb92427ae41e4649b934ca495991b7852b855","truncated":false},"timed_out":false},{"argv":["/usr/bin/x86_64-linux-gnu-g++-11","/tmp/score-quality-3gq_du8k/object-0.o","-fsanitize=undefined","-o","/tmp/score-quality-3gq_du8k/instrumented-program"],"elapsed_seconds":0.035582,"error":null,"exit_code":0,"name":"link","stderr":{"base64":"","bytes":0,"format":"text","retained_sha256":"e3b0c44298fc1c149afbf4c8996fb92427ae41e4649b934ca495991b7852b855","sha256":"e3b0c44298fc1c149afbf4c8996fb92427ae41e4649b934ca495991b7852b855","truncated":false},"stdout":{"base64":"","bytes":0,"format":"text","retained_sha256":"e3b0c44298fc1c149afbf4c8996fb92427ae41e4649b934ca495991b7852b855","sha256":"e3b0c44298fc1c149afbf4c8996fb92427ae41e4649b934ca495991b7852b855","truncated":false},"timed_out":false},{"argv":["/tmp/score-quality-3gq_du8k/instrumented-program"],"elapsed_seconds":0.001347,"error":null,"exit_code":0,"name":"runtime","stderr":{"base64":"","bytes":0,"format":"text","retained_sha256":"e3b0c44298fc1c149afbf4c8996fb92427ae41e4649b934ca49599